{
  "$schema": "https://json-schema.org/draft/2020-12/schema",
  "$id": "stats.schema.json",
  "title": "stats",
  "type": "object",
  "properties": {
    "sample": {
      "type": "boolean"
    },
    "generated_at": {
      "type": "string",
      "format": "date-time"
    },
    "channel": {
      "type": "object",
      "properties": {
        "title": {
          "type": "string"
        },
        "id": {
          "type": "string"
        },
        "url": {
          "type": "string",
          "pattern": "^https://"
        },
        "subs": {
          "type": "integer",
          "minimum": 0
        },
        "views": {
          "type": "integer",
          "minimum": 0
        },
        "video_count": {
          "type": "integer",
          "minimum": 0
        }
      },
      "required": [
        "title",
        "subs"
      ]
    },
    "median_views": {
      "type": "integer",
      "minimum": 0
    },
    "latest": {
      "type": "array",
      "items": {
        "type": "object",
        "properties": {
          "id": {
            "type": "string"
          },
          "title": {
            "type": "string"
          },
          "url": {
            "type": "string",
            "pattern": "^https://"
          },
          "published_at": {
            "type": "string",
            "format": "date-time"
          },
          "views": {
            "type": "integer",
            "minimum": 0
          },
          "vs_median": {
            "type": "number"
          }
        },
        "required": [
          "title",
          "published_at",
          "views",
          "vs_median"
        ]
      }
    }
  },
  "required": [
    "generated_at",
    "channel",
    "median_views",
    "latest"
  ]
}
